label,question
1, 단일화 결렬 대선 책임론에 권한 많은 사람이 책임 커 직격
1,자전거 타고 유세하는 이재명 대선후보
1,윤석열 후보 어린이 손 잡고 
1,순천 유세 이어가는 안철수 대선후보
1, 속보 단일화 위해 찾아가려 했지만 요청 와 시도 안 해 
1, 오차범위내 초접전
1,이재명 우크라 발언 의식 러시아 행위 용납해선 안돼 
1,대구지역 이재명이 약속합니다
1,강원 유세 연설하는 윤석열
1, 완주 안철수 지지표 에 뭉칠까 으로 흩어질까
1, 포토 윤석열 언제든 차를 돌려 안철수 직접 찾아뵙고 흉금 터놓고 싶다 
1, 포토 취재진 질문에 눈 감은 윤석열
1, 단일화 타결 직전 으로부터 결렬 통보 희망의 끈 놓치 않겠다 상보 
1,꽃다발 받는 윤석열
1,국방위 전체회의 출석한 서욱 정석환
1,포항 죽도시장 찾아 지지 호소하는 윤석열 후보
1,역대 최대 유권자 넘쳐나는 부동층 막판까지 대혼전
1,구미에서 지지호소하는 이재명 대선후보
1,윤석열 깃털같은 과거 공격하는 사람들 조국 문제엔 서초동 시위 
1, 윤석열 위험한 안보관 질타한 것 우크라 책임론 발언 해명
1,김포에서 지지자에게 0하는 이재명 대선후보
1,강릉 간 윤석열 대선 열흘 남기고 무슨 정치개혁 교체가 정치개혁 
1,이재명 부산 유세 구름인파 
1,열흘 남기고 또 나온 동률 적극투표층도 박빙
1,윤석열 포항 죽도시장 방문
1,지옥철 제가 해결하겠다 이재명 김포 찾아 지지호소
1,이재명 대선후보 경주에서 두 팔 번쩍 
1,윤석열 경북 강원 박 일 거점유세
1,포항에서 외치는 윤석열
1, 배우자 리스크 안철수 부부의 표심 호소
1,누가 당선돼도 유보 통합 교사 이해관계 중재가 관건
1, 단일화 무산 향해 권한 크기와 책임 크기 비례 
1,구미 간 이재명 나는 강력한 추진력 박정희 닮았다 
1,윤석열 오늘 유세 전격 취소
1,이재명 황리단길에서 자전거 유세차 시승
1,야권 단일화 관련 기자회견 마친 윤석열 대선 후보
1,윤석열 포항 성원 잊지 않겠습니다 
1, 정치보복은 나중에 몰래 이준석 어디다가 보복 혹은 이낙연 
1,심상정 유사시 들어올 수 있어 발언 경악스러워 
1, 포토 발언하는 원희룡 국민의힘 정책본부장
1,윤여준 직접 협상 과정 공개 앞으로 협상 않겠다는 얘기 
1, 한류 콘텐츠 무단 침해 건수 년 새 배 늘어났다
1,윤석열 이재명 정권교체 정권유지 
1, 뉴스초점 차 법정 토론 정치개혁 안보관 격돌
1, 영상 단일화 결렬 네 탓 공방 측 합의 깨 측 합의 없었다 
1,민주당 정치개혁 국민통합정부 당론 추인 
1, 에 책임 돌린 권한 많은쪽 책임 민주당 밀약설 엔 허위사실 
1, 정치개혁안 에 전부 사기꾼 맹공 펼친 국민의힘 단일화 투표 전날까지 노력 
1,윤석열 포항 죽도시장 유세
1,윤석열 유세 현장 후보 단상만 덩그라니 
1, 속보 윤석열 지금이라도 안철수 시간 장소 정하면 찾아가겠다 
1, 정치보복 냄새나는 말 그만 국민이 가만 두겠나 
1, 팩트체크 윤석열 부산저축은행 수사 때 일반대출은 기소 안 했다 
1,고창 전통시장서 지지 호소하는 안철수 후보
1,국내 우크라인 천여 명에 인도적 특별체류 허가
1, 속보 권영세 단일화 협상 내용은 공개 못해 투표 전날까지 단일화 노력 
1,부산 표심 호소하는 이재명
1, 현장의재구성 유세장 달구는 후보들의 퍼포먼스 나도 한다
1,답변하는 포항시장
1,이재명 이어령 빈소 조문 윤석열 문화계 거인 추모
1, 한미 주역 김현종 바이든 누가 상대할 수 있나 이재명 지지
1,포항에서 지지호소하는 윤석열 후보
1, 속보 윤석열 오늘 아침 시 단일화 결렬 최종 통보받아 
1,민주당 겨냥 다당제 정치개혁 찬성하는 세력 모두 함께 하자 
1,윤석열 강릉 민심 터치
1,울산 시민들과 0 나누는 이재명
1, 속보 언제든지 후보와 흉금 터놓고 이야기 나누고 싶다 
1, 서 통합 외친 이재명 정치개혁 앞세워 외연확장 시도 종합 
1, 포토 취재진 질문에 눈 감은 윤석열
1,고창 전통시장 찾은 안철수
1,윤석열 내가 강릉의 손자 
1,이재명 재정상 부담 기본소득 조금 미루겠다 
1,포항에서 어퍼컷 세리머니하는 윤석열 후보
1,심상정 권력 한푼도 사익에 써선 안돼 대구서 동시 공격
1,윤석열 민주당 내 합리적인 분들 이재명 세력에 기를 못 펴 갈라치기
1,강릉 월화거리광장에 모인 유권자들
1,이재명 부산을 위해 나를 위해 
1,윤석열 강릉 표심 공략
1, 대선 말말말 빌릴 머리라도 있어야 정권교체 물타기 
1,검단 신도시 거주자들과 간담회 갖는 윤석열
1, 희망의 끈 안놔 이미 시한 종료 
1,현안보고하는 서욱 국방부장관
1, 쿡 에 등장한 이재명 노무현 문재인과 저 이재명 다르지 않다 
1,발언하는 윤호중 공동선대위원장
1, 오늘도 달리는 이재명 
1,윤석열 정치쇼 이재명 민주당 정권교체 여론을 정치개혁으로 물타기 
1,합장하는 이재명 대선후보
1,원우명부에 기재된 김건희 씨의 도이치모터스 이사 경력
1,강원 유세 나선 윤석열
1,국힘 소속 울산 광역 기초의원 군산조선소 재가동 철회하라 
1,취재진 질문에 답하는 윤석열 후보
1,경주에서 지지호소하는 이재명 대선후보
1, 포토 국민의힘 선거대책본부 전체회의 주재하는 권영세 선거대책본부장
1,윤석열 어머니 고향에 왔습니다 
1, 찾은 이재명 통합의 정치로 평화대통령 경제대통령 되겠다 
1,권영세 단일화 어려워진 것 인정 노력해서 받아들여질지 의문 
1,단일화 결렬 관련 긴급기자회견하는 국민의당
1, 미사일 발사 규탄 한반도 동북아에 긴장 조성 
1,윤석열 사전투표 해달라 부정선거 감시 잘 하겠다 
1,포항에서 지지호소하는 이재명 대선후보
1,경주 찾아 유세 나선 이재명 후보
1, 측 협상일지 제목 정리해서 못만나면 깐다 년 전 문서라서 
1, 단일화 무산 겨냥 권한 크기와 책임 크기 비례 
1,윤석열 방역지원금 만원으론 불충분 최대 천만원 지원 
1,민주당 의원총회장에 등장한 김건희 씨 년 서울대 수첩
1,이재명 위기에 강한 경제대통령
1,이재명 대선후보 포항 유세
1,정치분야 토론 권력구조 개편 안보관 격돌
1, 포토 공개된 대장동 배수구 문건
1, 유관순에게 미안하지 않나 민주당 정계서 쫓아내자 
1, 오늘의 주요일정 정치 월 일 일요일 
1, 측 단일화 일지 공개에 반발 수사기관 허위조서 보는 느낌 
1,권영세 이 만나자면 차 돌려 가겠다는 것은 진심 
1, 이재명 윤석열 접전 진영 결집 불붙었다 종합 
1,홍남기 부총리 만난 이광재 외통위원장
1,민주당은 쾌재 윤석열 사실상 단일화 포기 선언 
1,어린이와 기념촬영하는 이재명 대선후보
1, 최대 승부처 수도권서 민주당 년간 완벽하게 실패 종합 
1,이태규 국힘 안철수에 이중플레이 이미지 씌워 
1,성소수자부모모임 회원들과 기념촬영하는 심상정 후보
1,이재명 대선후보 포항 민심 향해 
1,정의 여영국 대표에 임명장 보내 사리분별 똑바로 하라 종합 
1,국방위 전체회의 탄도미사일 우크라 현안 질의 
1, 주말 한밤 의총서 정치개혁안 추인 에 러브콜
1, 대선 선관위도 비상 일부터 여론조사 블랙아웃 일 사전투표
1, 남부수도권 실현위원회 출범 직접 위원장 맡는다
1,이재명 동대구역 광장 집중유세
1,윤석열 대선후보 지지 호소 
1,윤석열 단일화 결렬 통보 받아 지금이라도 안철수 만나 얘기하고 싶다 
1,거북선 모형 선물 받은 이재명 대선후보
1,방명록 작성하는 심상정 후보
1,흑두루마기와 태극기 선물받는 이재명
1,안철수 연금개혁 선언 이어 정치보복 금지 선언하자 
1,이준석 경쟁력 충분 단일화해도 지지율 격차 큰 변화 없어 
1,자료 살펴보는 윤호중 원내대표와 이용우 의원
1,윤석열 원전 발언 직격 잘못된 판단으로 허송세월 
1,주말 유세 나선 윤석열 민주당 좌파 운동권 세력 
1, 국민이 키운 윤석열 내일을 바꾸는 대통령 
1, 단일화 법인카드 소고기 탄핵세력 누가 부활시켰나
1,소상공인 자영업자 신용대사면 긴급금융구제 지원공약 발표
1,서욱 국방장관 국방위 전체회의 현안 보고
1,국민을 위해 했다 그리고 한다 이재명 번째 광고
1,강릉 유세 마친 윤석열 어퍼컷 세리머니
1,국민을 위해 했다 그리고 한다 이재명 번째 광고
1,윤석열 후보 연설에 환호하는 포항 시민들
1,창원 찾은 이재명 후보
1, 일본군 한반도 진주 취지 충격적 국힘 허위 억지 
1,경주 황리단길서 유세 나선 이재명 후보
1, 자영업자가 가장 바라는 것은 시간 영업 백신패스도 폐기 
1,민주당 선대위 사전투표 독려 퍼포먼스 
1,이준석 공격 위해 외교결례한 사람 연일 이재명 때리기
1,창원 유세하는 이재명
1,국민을 위해 했다 그리고 한다 이재명 번째 광고
1, 이재명은 합니다 남부수도권 시대 
1,이재명 자전거 타고 친환경 선거운동 
1, 윤석열 단일화 포기 선언 에 책임 덮어씌워 
1,일산 찾아 지지 호소하는 이재명 대선후보
1,민주 유사시 개입 발언에 경악스러운 망언 맹폭
1,나란히 연단 오른 윤석열 이준석
1,이재명 후보 이어령 초대 문화부 장관 빈소 조문
1, 측 단일화 결렬 책임 공방
1, 오늘아침 측 전해온 내용 고려할 가치 없다고 결론 내려 종합 
1,이재명 대선후보 청년들 손 잡고 
1, 포토 국방위에서 현안보고하는 서욱 국방부 장관
1,안철수 서울 집중 유세 광장시장 강남역 찾는다
1,유세 지켜보는 시민들
1, 대선 사라진 대선공약 가계부 국민 검증 기회마저 박탈
1,포항 찾은 이재명 빌릴 머리라도 있어야 직격 
1, 영상 진실게임 된 단일화 안철수 여론조사 협상테이블에 올렸다 
1,이재명 시대의 지성 이어령 초대 문화부 장관 빈소 조문
1, 영상 윤석열 유세현장서 또 여성 목 조르고 질질 끌었다
1, 취업용 건강진단결과서 무료화 규제 샌드박스 활성화 지원 
1,원희룡 이재명 한마디로 입벌구 맹비난
1,다음주가 대선인데 와 충돌 불사하는 대통령 무슨 이유
1,단일화 협상 관련 기자회견 위해 회견장 들어서는 윤석열 후보
1, 비난 의식했나 유세 도중 러시아 행위 용납해선 안 돼 
1, 단일화 무산 향해 권한 크기와 책임 크기 비례 
1,지지자 손 잡는 이준석 대표
1,이재명 자전거 타고 친환경 선거운동 
1, 전술핵 배치 한번도 주장 안해 지난해 월 공약 팩트체크 
1,이재명 따르릉 따르릉 
1, 토론 위성정당 격돌 민주당 정의당 뒤통수치고 배신 국힘이 시작 
1,파주 찾아 지지 호소하는 이재명
1, 김건희 작전주 의혹 사와 공동주관 전시 의혹 국힘 생떼탕 시즌 종합 
1,윤석열 후보 정권교체 
1,이재명 대선후보 포항 시민 향한 연설 
1,윤석열 후보는 어디에 
1,심상정 변희수 하사 추모 국방장관이 와서 무릎 꿇어야 
1,이재명 대선후보 포항에서 엄지 척 
1, 민주당 정권 대러 제재 동참 안해 수출 통제 받는 신세 
1, 중앙지검 재직 시 장모 최씨 신안저축 서 억 대출 
1,꽃다발 받은 윤석열
1, 국민의힘 선거 전략은 
1,이재명 통합정부 윤석열 정치쇼 안보서도 안방장비 유약 충돌 차 토론 
1,심상정 후보 성인지 예산으로 북핵 막자 는 에 또 하나의 망언 사과하라 
1,국회 국방위 전체회의 탄도미사일 현안 질의 
1, 공약 좀 들어봅시다 
1,안철수 후보 부부동반 선거유세 
1, 영상 국민의힘은 단일화 끈 놓지 않아 국민의당은 끝났다 
1,경산시장 메운 청중
1,이재명 기초연금 만 만원 인상 부부감액제 폐지 
1,안전모 손에 든 이재명
1, 주가조작하면 책임을 부끄러운 줄 알아야 
1,창원서 지지 호소하는 이재명 후보
1, 영상 단일화 결렬 협상의 민낯 공개한 떠넘기는 모습 만 부각
1,나경원 일 제주 방문 윤석열 지지 호소 예정
1,윤석열 후보 양천구 목동서 유세
1,자전거 유세 나선 이재명
1, 자위대 망언 순국선열 앞 사죄하라 특별성명 발표
1,강릉 간 윤석열 대선 열흘 남기고 무슨 정치개혁 교체가 정치개혁 
1, 측 만나자고 해 들어보자고 만난 것에 불과 고려할 가치 없다 결론 내려 종합 
1, 포토 윤석열 안철수와 전날 단일화 합의했지만 오늘 오전 시 결렬 통보받아 
1, 측 측 신뢰 어려운 세력 뜻대로 안되자 입맛맞게 까발려 종합 
1, 일 담판 카드만 남은 단일화 안철수 만나 결단할까
1, 역대급 비호감 대선 막말 묻지마 폭로에 고소 고발장 산더미
1,창원에서 연설하는 이재명 후보
1, 그래픽 민주 국힘 지지율 동률 문 대통령 
1,이재명 한 번 가입으로 시도 내 모든 공공도서관 도서 대출 반납 
1,이재명 고향 공략 시동
1,지지 호소하는 안철수 후보
1,정순택 천주교 대주교와 환담하는 새로운물결 김동연 대선후보
1,송영길 잘 부탁드리겠습니다 
1,유세하는 이재명
1,황리단길에서 연설하는 이재명 대선후보
1,대구 시민들과 호흡하는 이재명
1,안철수 종로 강남 유세 유튜브 출연도
1, 민심은 어디로 향하나 
1, 완주 안철수 지지표 에 뭉칠까 으로 흩어질까
1, 겨냥 우크라사태 답도 머리에 없는데 어떻게 대통령하나 
1,표심 구애하는 이재명
1,답변하는 윤리특별위원회 여당 간사 한병도 의원
1,안철수 윤석열 토론 환기 머릿속에 답 없는 사람 
1,푸틴이냐 국제적 욕먹은 이재명에 윤석열 대신 사과 
1,심상정 대통령은 도덕성이 중요 제주 제 공항 백지화 공약 
1, 현장 이재명 창원서 홍준표 무상급식 폐지 성남과 비교돼 덕 봤다 
1,지지자들과 0하는 윤석열 후보
1, 단일화 멀어졌어도 대선 당일 대진표 여전히 알 수 없다
1, 단일화 결렬 여진 계속 책임돌리기 신경전 이유는
1,이재명 대선후보 자전거 유세
1, 대 대선 유권자들의 선택은
1,안철수 후보 고창 상인들 손 꼭 잡고 
1,이재명 싸울 필요 없는 평화 윤석열 힘에 의한 평화 안보관 정면 충돌
1,윤석열 강원 민심을 잡아라 
1,윤석열 방역패스 완전 철폐 방역지원금 최대 만원 
1,군 당국 사드 자재 반입 주 회로 확대 반대단체 반발
1,지지자들 향해 0하는 이재명 대선후보
1,부산에서 지지자에게 0하는 이재명 대선후보
1, 대선 단일화 토론 말실수 따라 승자 갈린다
1, 대 대선 유권자들의 선택은
1,권영세 추가 요구는 사퇴 모양새 그것도 다 됐는데 돌연 결렬 
1,이재명 윤석열 접전 서울 
1,이재명 윤석열 수도권 맞불 유세 안보관 등 격돌
1,이재명 대선후보 고양 집중 유세
1, 속보 얘기하면 지금이라도 찾아갈 것 화답 기다려 
1, 정치개혁 국민통합 빅텐트 마련 정의당 선거용 의혹 진정성 의심 
1,민주당 충청권 국회의원 지방기업 법인세 감면 이재명 공약 지지
1,이재명 표심 잡아라 
1,윤석열 연호하는 포항 시민들
1, 영상 단일화 결렬 속 다시 초박빙 구도 여야 중도 표심 에 사활
1,이재명 평화번영 추구하지만 도발 어떤 경우도 용납 않을 것 
1,취재진 질문에 답하는 안철수
1, 장모 동업자 감옥 보내고 억 차익 날조된 마타도어 
1, 민주운동 기념식 참석한 김부겸 총리
1,포항 찾은 이재명 빌릴 머리라도 있어야 직격 
1,윤석열 조 성인지 예산 일부만 써도 북핵 위협 막아 
1, 포토 공개된 대장동 배수구 문건
1,윤석열이 보러 나온 구름 관중
1,전남 민심 향하는 안철수 후보
1,윤석열 흥겨운 어퍼컷 세리머니
1,포항 찾아 지지 호소하는 이재명
1,대구 시민들에게 엄지 척 보내는 이재명
1,이재명 대선후보 두 팔 치켜 세우며 
1,어퍼컷 세리머니 하는 윤석열
1, 오늘 집중 유세 안동 출신 이재명 대통령 만들어달라 호소
1,답변하는 서욱 국방부 장관
1, 녹취구성 푸틴 우크라군에 권력장악 국가지도부 제거 촉구
1,지지자들 향해 하트 만드는 이재명 대선후보
1,꽃다발 손에 든 윤석열 대선후보
1,윤석열 구로를 디지털 굳로 로 
1, 옛 친박계 이정현 윤석열 지지 호소 정권교체가 최고의 선 
1, 시대의 지성 이어령 초대 문화부 장관 빈소 조문하는 이재명
1,윤석열 에 참여 필요 심상정 전략적 균형 무너져 
1,윤석열 후보 어퍼컷 세리머니 
1, 윤석열차 이준석 이재명 출생지 안동서 형수욕설 훈육해달라 
1,이재명 통합정부 윤석열 정치쇼 안보서도 안방장비 유약 충돌 차 토론 
1, 꽃 받는 안철수 후보 
1,두루마기에 태극기 든 이재명 대통령만 사고 안치면 전쟁없어 
1,윤석열 강원 개 지역 훑는다 정권교체 표심 호소
1, 측 토론회 사회자 편파진행 엔 답변준비 시간 호의 
1, 선제타격 의지로 전쟁예방 자극적 발언이 도발 지적 나와 
1,안철수 준공 년 넘은 아파트 무료 안전점검 실시 주거 안전 보장 
1, 통합정치는 의 꿈 의 소망 보수텃밭서도 러브콜 영상 
1,당사 나서는 윤석열 후보
1,순천 찾은 안철수 김미경 부부
1, 이재명 윤석열 소수점까지 같았다
1,이재명 협치 제안에 심상정 민주당이 키운 윤석열 작심 비판
1,기자회견 입장하는 윤석열 후보
1, 에도 초박빙 판세 투표율과 지지층 결집이 관건
1, 포토 대장동 배수구 문건 실물
1,전쟁반대 외치던 여학생 폭행 방관 국힘당 규탄한다 
1,윤석열 번에게 표를
1,단일화 관련 입장 밝히는 안철수
1, 오후 시 단일화 회견 여론조사 수용 공동정부 제안 전망 종합 
1,포항 유세장 도착한 이재명 후보
1, 전화면접은 역전 
1,대구서 지지연설하는 이재명 대선후보
1,꽃다발 받은 이준석 대표
1,대구 유세 참석자들과 주먹0하는 이재명 후보
1,경기 지역 공약판 들어보이는 이재명
1,권성동 의원과 대화하는 윤석열 후보
1,이재명 선조 정조 보라 리더는 빌릴 머리 라도 있어야 
1,빙하 타고 온 둘리 안중근이 나라 팔았나 최고조 달한 신경전
1,주말 잊고 달리는 이재명
1,이재명 창원 유세
1, 일본군 한반도 진주 취지 충격적 국힘 허위 억지 
1,이재명 요청으로 다당제 개혁 추인 에 본격 대시 
1, 측 공동0권 제안 이태규 보고 세부내용 못들어 
1,전남 여수서 유세 이어가는 안철수 후보
1,황리단길 찾아 자전거 유세 선보이는 이재명
1, 헤럴드 대장동 배수구 문건을 공개하는 국민의힘 원희룡 정책본부장
1, 데일리안 오늘뉴스 종합 윤석열 과 단일화 최종 합의 단계에서 결렬 통보 받았다 코로나 백신 차접종률 중 번째로 높아 러시아 스위프트 퇴출 제재 수위 
1, 우크라 항전 응원 우크라 대통령 비하하다 국제망신 
1,울산서 지지 호소하는 이재명 후보
1, 정치 대선 단일화 없이 투표용지 인쇄 시작
1,국힘 대장동 의혹 대선까지 뭉개려는 것 
1, 포토 마스크 다시 쓰는 윤석열
1,양천구 지지자들에게 0하는 윤석열
1, 이재명이 부산에 왔습니다 
1, 정치보복 없다 대국민 선언하자 보복한다면 국민이 가만 놔두겠나 
1,이재명 윤석열 안철수 심상정 당선가능성 이 윤 
1,이재명 간절한 호소
1,이재명 대선후보 민심을 잡아라 
1,노무현 전 대통령 손자 끌어안은 이재명 대선후보
1,저출생 원전 정책 어떻게 바뀌나 후보별 사회 공약
1,김재연 거대 양당 정치로 구조화된 불평등 해결할 것 
1,윤호중 윤석열 자위대 망언 순국선열 희생 부정 역사 모욕 
1,우상호 러 침략이 가장 잘못 우크라 대통령 미숙한 점도 사실 
1,이재명 박 일 방문 취약지 공략
1,윤석열 강원 유세 시작
1, 민주운동 기념탑 방문한 김부겸 총리
1, 민주운동 기념탑 참배하는 김부겸 총리
1, 인기만점 안철수 부부
1,부산에서 외치는 이재명은 합니다 
1,이재명 윤석열 단일화시 더 접전 한국갤럽 
1, 최대 승부처 수도권서 민주당 년간 완벽하게 실패 종합 
1, 안보관 겨냥한 이낙연 평화와 안보 벼락공부로 안돼 
1, 단일화 무산에 직격 권한 많은 사람 책임도 커 
1,이낙연 결사항전 젤렌스키와 우크라 국민에 경의 
1,공약 서약식하는 이재명 후보
1, 포토 윤석열 후보 단일화 결렬 
1,이재명 대선후보 창원유세
1, 단일화 파국에 네 탓 공방 극적 반전 가능성 희박 
1,이재명 대선후보 구미 유세
1, 우크 대통령 책임 러 규탄 이준석 국제적 이슈도 말장난 
1, 측 만나자고 해 들어보자고 만난 것에 불과 고려할 가치 없다 결론 내려 종합 
1, 영상 이완용이 안중근 비난 이 몸통 또 대장동으로 얼룩진 토론
1,민주 탄도미사일 도발 강력 규탄 평화 위협 멈추라 
1,이재명 자전거 유세차 타고 주먹0
1,윤석열 에 일 전화 통화는 불발 주말 만남 성사될까
1,우크라 안보 설전 윤석열 신냉전 몰라 이재명 물귀신 작전 
1, 지지자들과 0 나누며 
1, 에 보낸 문자 통 공개 진정성 믿어달라 만나서 얘기하자 
1,심상정 후보 고인에게 헌화 
1,이재명 윤석열 안철수 리얼미터 
1, 단일화 무산에 직격 권한 많은 사람 책임도 커 
1, 으로부터 단일화 들은 바 없다 철저하게 무시당했다 
1,포항에서 지지자들에게 0하는 윤석열 후보
1,심상정 공군 성폭력 피해 이예람 중사 사망사건 특검해야 
1, 지지자 홀린 어퍼컷 세리머니
1,취재진 질문에 답하는 한병도 국회 윤리특별위원회 여당 간사
1,이재명 징용 위안부 해결책 에 요청말고 이 찾아내라 
1, 단일화 타결 직전 으로부터 결렬 통보 희망의 끈 놓치 않겠다 종합 
1,태극기 흔드는 이재명 후보
1,손 맞잡아 들어올리는 이재명 대선후보
1,단일화 협상 관련 기자회견 마치고 회견장 나서는 윤석열 후보
1,이재명 민심에 호소
1,포효하는 이재명
1, 주말 유세서 망언 공세 김건희 주가조작도 겨냥 종합 
1,강릉 간 윤석열 대선 열흘 남기고 무슨 정치개혁 교체가 정치개혁 
1,이재명 대선후보 연설 듣는 창원 시민
1,코로나 대확산 속 투표율 주목 유불리 속단 어렵다
1,윤석열 대통령 탈원전 뒤집었다 직격
1,유세하는 심상정
1, 단일화 출구전략 가동 표로 단일화 승부수
1,포항 간 윤석열 부정선거 걱정말고 사전투표 해달라 종합 
1, 장모 동업자 감옥 보내고 억 수익 거짓 자료 
1,부산 찾은 이재명 대선후보 남부 지역 새로운 수도권 만들자 
1, 단일화 파국 여론전 펼치며 허위사실 유포 공방까지 종합 
1, 내일 긴급의총 이재명표 정치개혁 당론 추인
1,경주서 지지호소하는 이재명 후보
1,우상호 한미일 동맹 해명에 이 사람들이 국민을 바보로 아나 
1, 토론 이재명 우크라 먼 나라 발언 지적에 거짓말 자주 해 
1,윤석열 경북 구석구석 텃밭 다지기 이준석 동행
1,안철수 윤석열 토론 환기 머릿속에 답 없는 사람 
1, 속보 윤석열 오늘 아침 시 단일화 결렬 최종 통보받아 
1,일산 찾은 이재명 대선후보 파란 장미 손에 들고 
1, 간 이재명 통합정부 강조 주가조작 뼈도 못추리게 해야 
1,한 치 앞 안보이는 대혼전 양강 긴장감 고조
1, 포토 윤석열 후보 부동시 면제의혹과 관련한 자료 바라보는 정석환 병무청장
1,이낙연 러시아 국제법 위반 
1,윤석열과 안철수 마주보고 0
1,이낙연 결사항전 우크라이나 대통령과 용감한 국민들께 경의 
1, 영상 타임라인까지 공개된 단일화 최종합의 이후 결렬 이유 모르겠다 
1,지지연설 단상에 올라선 
1,국민의힘 이재명 반일선동 중단하라 전날 토론 차전 치열
1, 포항 찾아 박태준 존경 외가 강릉 찾아 정권교체 
1,우크라 사태 놓고 서로 유약한 태도 큰소리만 뻥뻥 안방 장비 
1,포효하는 이재명
1,강릉 찾아 정권교체 외치는 윤석열 후보
1, 뉴스초점 차 법정 토론 정치개혁 안보관 격돌
1,정의 정치개혁안 법안별 당론채택 여부 모호 선거용 의혹 
1,민주당 충청권 국회의원 지방기업 법인세 감면 이재명 공약 지지
1,윤석열 어퍼컷으로 표심 얻기 
1,팔 걷어부친 이재명
